{
  "sid": "eessi:prc:1.0",
  "jti": "unique-token-12345",
  "rid": "https://example.org/revocation/123",
  "prc": {
    "ic": "BE",
    "fn": "Wonderland",
    "gn": "Alice",
    "dob": "1984-07-20",
    "hi": "84072002127",
    "in": "CM",
    "ii": "0120",
    "ci": "01200000001234567890",
    "sd": "2025-01-01",
    "ed": "2025-12-31",
    "xd": "2025-12-31",
    "di": "2025-03-12"
  }
}
